{
  "$schema": "http://json-schema.org/draft-07/schema#",
  "$id": "https://github.com/KryptosAI/mcp-observatory/schemas/run-artifact.schema.json",
  "title": "MCP Observatory Run Artifact",
  "type": "object",
  "additionalProperties": false,
  "required": [
    "artifactType",
    "schemaVersion",
    "gate",
    "runId",
    "createdAt",
    "toolVersion",
    "target",
    "environment",
    "summary",
    "checks"
  ],
  "properties": {
    "artifactType": { "const": "run" },
    "schemaVersion": { "const": "1.0.0" },
    "gate": { "$ref": "#/definitions/gate" },
    "runId": { "type": "string" },
    "createdAt": { "type": "string" },
    "toolVersion": { "type": "string" },
    "target": { "$ref": "#/definitions/targetSnapshot" },
    "environment": { "$ref": "#/definitions/environmentSnapshot" },
    "summary": { "$ref": "#/definitions/runSummary" },
    "checks": {
      "type": "array",
      "items": { "$ref": "#/definitions/checkResult" }
    },
    "healthScore": { "$ref": "#/definitions/healthScore" },
    "performanceMetrics": { "$ref": "#/definitions/performanceMetrics" },
    "runtimeProfile": { "$ref": "#/definitions/runtimeProfile" },
    "toolDecisions": {
      "type": "array",
      "items": { "$ref": "#/definitions/toolDecision" }
    },
    "notObserved": {
      "type": "array",
      "items": { "$ref": "#/definitions/notObserved" }
    },
    "fatalError": { "type": "string" }
  },
  "definitions": {
    "gate": { "type": "string", "enum": ["pass", "fail"] },
    "checkStatus": {
      "type": "string",
      "enum": ["pass", "fail", "partial", "unsupported", "flaky", "skipped"]
    },
    "checkId": {
      "type": "string",
      "enum": [
        "tools",
        "prompts",
        "resources",
        "tools-invoke",
        "security",
        "security-lite",
        "attack-sim",
        "conformance",
        "schema-quality",
        "runtime-profile"
      ]
    },
    "evidenceSummary": {
      "type": "object",
      "additionalProperties": false,
      "required": ["endpoint", "advertised", "responded", "minimalShapePresent"],
      "properties": {
        "endpoint": { "type": "string" },
        "advertised": { "type": "boolean" },
        "responded": { "type": "boolean" },
        "minimalShapePresent": { "type": "boolean" },
        "itemCount": { "type": "integer", "minimum": 0 },
        "identifiers": {
          "type": "array",
          "items": { "type": "string" }
        },
        "diagnostics": {
          "type": "array",
          "items": { "type": "string" }
        },
        "schemas": {
          "type": "object",
          "additionalProperties": { "type": "object" }
        },
        "responseSnapshots": {
          "type": "object",
          "additionalProperties": true
        },
        "findings": {
          "type": "array",
          "items": {
            "type": "object",
            "additionalProperties": true
          }
        }
      }
    },
    "checkResult": {
      "type": "object",
      "additionalProperties": false,
      "required": ["id", "capability", "status", "durationMs", "message", "evidence"],
      "properties": {
        "id": { "$ref": "#/definitions/checkId" },
        "capability": { "$ref": "#/definitions/checkId" },
        "status": { "$ref": "#/definitions/checkStatus" },
        "durationMs": { "type": "number", "minimum": 0 },
        "message": { "type": "string" },
        "evidence": {
          "type": "array",
          "items": { "$ref": "#/definitions/evidenceSummary" }
        }
      }
    },
    "statusCounts": {
      "type": "object",
      "additionalProperties": false,
      "required": ["total", "pass", "fail", "partial", "unsupported", "flaky", "skipped"],
      "properties": {
        "total": { "type": "integer", "minimum": 0 },
        "pass": { "type": "integer", "minimum": 0 },
        "fail": { "type": "integer", "minimum": 0 },
        "partial": { "type": "integer", "minimum": 0 },
        "unsupported": { "type": "integer", "minimum": 0 },
        "flaky": { "type": "integer", "minimum": 0 },
        "skipped": { "type": "integer", "minimum": 0 }
      }
    },
    "runSummary": {
      "type": "object",
      "additionalProperties": false,
      "required": ["total", "pass", "fail", "partial", "unsupported", "flaky", "skipped", "gate"],
      "properties": {
        "total": { "type": "integer", "minimum": 0 },
        "pass": { "type": "integer", "minimum": 0 },
        "fail": { "type": "integer", "minimum": 0 },
        "partial": { "type": "integer", "minimum": 0 },
        "unsupported": { "type": "integer", "minimum": 0 },
        "flaky": { "type": "integer", "minimum": 0 },
        "skipped": { "type": "integer", "minimum": 0 },
        "gate": { "$ref": "#/definitions/gate" }
      }
    },
    "targetSnapshot": {
      "type": "object",
      "additionalProperties": false,
      "required": ["targetId", "adapter", "command", "args"],
      "properties": {
        "targetId": { "type": "string" },
        "adapter": { "type": "string", "enum": ["local-process", "http"] },
        "command": { "type": "string" },
        "args": {
          "type": "array",
          "items": { "type": "string" }
        },
        "url": { "type": "string" },
        "cwd": { "type": "string" },
        "metadata": {
          "type": "object",
          "additionalProperties": { "type": "string" }
        },
        "serverVersion": { "type": "string" },
        "serverName": { "type": "string" }
      }
    },
    "environmentSnapshot": {
      "type": "object",
      "additionalProperties": false,
      "required": ["platform", "nodeVersion"],
      "properties": {
        "platform": { "type": "string" },
        "nodeVersion": { "type": "string" }
      }
    },
    "scoreDimension": {
      "type": "object",
      "additionalProperties": false,
      "required": ["name", "weight", "score", "details"],
      "properties": {
        "name": { "type": "string" },
        "weight": { "type": "number" },
        "score": { "type": "number" },
        "details": {
          "type": "array",
          "items": { "type": "string" }
        }
      }
    },
    "healthScore": {
      "type": "object",
      "additionalProperties": false,
      "required": ["overall", "grade", "dimensions"],
      "properties": {
        "overall": { "type": "number" },
        "grade": { "type": "string", "enum": ["A", "B", "C", "D", "F"] },
        "dimensions": {
          "type": "array",
          "items": { "$ref": "#/definitions/scoreDimension" }
        }
      }
    },
    "toolDecision": {
      "type": "object",
      "additionalProperties": false,
      "required": ["toolName", "decision", "reason", "findingIds"],
      "properties": {
        "toolName": { "type": "string" },
        "decision": { "type": "string", "enum": ["allow", "review", "block"] },
        "reason": { "type": "string" },
        "findingIds": {
          "type": "array",
          "items": { "type": "string" }
        }
      }
    },
    "performanceMetrics": {
      "type": "object",
      "additionalProperties": false,
      "required": ["connectMs"],
      "properties": {
        "connectMs": { "type": "number", "minimum": 0 },
        "toolsListMs": { "type": "number", "minimum": 0 },
        "promptsListMs": { "type": "number", "minimum": 0 },
        "resourcesListMs": { "type": "number", "minimum": 0 },
        "toolInvokeMs": {
          "type": "object",
          "additionalProperties": { "type": "number", "minimum": 0 }
        }
      }
    },
    "egressEntry": {
      "type": "object",
      "additionalProperties": false,
      "required": ["target", "protocol", "source", "confidence"],
      "properties": {
        "target": { "type": "string" },
        "protocol": { "type": "string" },
        "source": { "type": "string" },
        "confidence": { "type": "string", "enum": ["high", "medium", "low"] }
      }
    },
    "stateMutation": {
      "type": "object",
      "additionalProperties": false,
      "required": ["resource", "operation", "scope", "source"],
      "properties": {
        "resource": { "type": "string" },
        "operation": { "type": "string" },
        "scope": { "type": "string" },
        "source": { "type": "string" }
      }
    },
    "runtimeProfile": {
      "type": "object",
      "additionalProperties": false,
      "required": ["analyzedAt", "confidence"],
      "properties": {
        "egress": {
          "type": "array",
          "items": { "$ref": "#/definitions/egressEntry" }
        },
        "stateMutations": {
          "type": "array",
          "items": { "$ref": "#/definitions/stateMutation" }
        },
        "analyzedAt": { "type": "string" },
        "confidence": { "type": "string", "enum": ["high", "medium", "low"] }
      }
    },
    "notObserved": {
      "type": "object",
      "additionalProperties": false,
      "required": ["category", "detail", "severity"],
      "properties": {
        "category": { "type": "string" },
        "detail": { "type": "string" },
        "severity": { "type": "string", "enum": ["info", "warning"] }
      }
    }
  }
}
