{
  "artifactType": "run",
  "schemaVersion": "1.0.0",
  "gate": "fail",
  "runId": "run_2026-07-15T223450990Z_66e00a16",
  "createdAt": "2026-07-15T22:34:50.990Z",
  "toolVersion": "1.32.1",
  "target": {
    "targetId": "aws-mcp-server",
    "adapter": "local-process",
    "command": "npx",
    "args": [
      "-y",
      "mcp-server-aws"
    ],
    "cwd": ".",
    "metadata": {
      "package": "mcp-server-aws",
      "purpose": "mcp-safety-index",
      "riskClass": "Cloud infrastructure control",
      "failureClass": "AWS service boundary",
      "whyItMatters": "AWS MCP servers can interact with EC2, Lambda, S3, IAM, and other AWS services — broad cloud control surface for agents."
    }
  },
  "environment": {
    "platform": "darwin 25.5.0",
    "nodeVersion": "v22.22.1"
  },
  "summary": {
    "total": 3,
    "pass": 0,
    "fail": 0,
    "partial": 0,
    "unsupported": 0,
    "flaky": 0,
    "skipped": 3,
    "gate": "fail"
  },
  "checks": [
    {
      "id": "tools",
      "capability": "tools",
      "status": "skipped",
      "durationMs": 0,
      "message": "Skipped because startup failed before the MCP session initialized. See the failure diagnosis.",
      "evidence": []
    },
    {
      "id": "prompts",
      "capability": "prompts",
      "status": "skipped",
      "durationMs": 0,
      "message": "Skipped because startup failed before the MCP session initialized. See the failure diagnosis.",
      "evidence": []
    },
    {
      "id": "resources",
      "capability": "resources",
      "status": "skipped",
      "durationMs": 0,
      "message": "Skipped because startup failed before the MCP session initialized. See the failure diagnosis.",
      "evidence": []
    }
  ],
  "fatalError": "Could not establish a plain stdio MCP session for target `aws-mcp-server`.\nCommand: npx -y mcp-server-aws\nDiagnosis: The process exited or detached before MCP initialization completed.\nRaw error: MCP error -32000: Connection closed\nLikely causes:\n- The package may expect extra startup arguments or environment variables.\n- The package may not behave like a plain local-process stdio target under this invocation.\n- The server may be crashing immediately and only leaving clues on stderr.\nNext steps:\n- Run the command manually and look for usage output, auth prompts, or crash text.\n- Check whether the package expects a different transport or an app-oriented startup flow.\n- Use the recent stderr lines below before assuming this is a harness bug.\nRecent stderr:\n- npm error could not determine executable to run\n- npm error A complete log of this run can be found in: /Users/williamweishuhn/.npm/_logs/2026-07-15T22_34_51_068Z-debug-0.log"
}
