{
  "artifactType": "run",
  "schemaVersion": "1.0.0",
  "gate": "fail",
  "runId": "run_2026-07-15T223511362Z_6857c47e",
  "createdAt": "2026-07-15T22:35:11.362Z",
  "toolVersion": "1.32.1",
  "target": {
    "targetId": "chatwoot-mcp",
    "adapter": "local-process",
    "command": "npx",
    "args": [
      "-y",
      "chatwoot-mcp"
    ],
    "cwd": ".",
    "metadata": {
      "package": "chatwoot-mcp",
      "purpose": "mcp-safety-index",
      "riskClass": "Customer engagement platform access",
      "failureClass": "Conversation/contact/inbox boundary",
      "whyItMatters": "Chatwoot (34K+ GitHub stars, Indian OSS) is an open-source customer engagement platform. MCP servers sending messages, managing contacts, and accessing conversation history need privacy and consent boundaries."
    }
  },
  "environment": {
    "platform": "darwin 25.5.0",
    "nodeVersion": "v22.22.1"
  },
  "summary": {
    "total": 3,
    "pass": 0,
    "fail": 0,
    "partial": 0,
    "unsupported": 0,
    "flaky": 0,
    "skipped": 3,
    "gate": "fail"
  },
  "checks": [
    {
      "id": "tools",
      "capability": "tools",
      "status": "skipped",
      "durationMs": 0,
      "message": "Skipped because startup failed before the MCP session initialized. See the failure diagnosis.",
      "evidence": []
    },
    {
      "id": "prompts",
      "capability": "prompts",
      "status": "skipped",
      "durationMs": 0,
      "message": "Skipped because startup failed before the MCP session initialized. See the failure diagnosis.",
      "evidence": []
    },
    {
      "id": "resources",
      "capability": "resources",
      "status": "skipped",
      "durationMs": 0,
      "message": "Skipped because startup failed before the MCP session initialized. See the failure diagnosis.",
      "evidence": []
    }
  ],
  "fatalError": "Could not establish a plain stdio MCP session for target `chatwoot-mcp`.\nCommand: npx -y chatwoot-mcp\nDiagnosis: The process exited or detached before MCP initialization completed.\nRaw error: MCP error -32000: Connection closed\nLikely causes:\n- The package may expect extra startup arguments or environment variables.\n- The package may not behave like a plain local-process stdio target under this invocation.\n- The server may be crashing immediately and only leaving clues on stderr.\nNext steps:\n- Run the command manually and look for usage output, auth prompts, or crash text.\n- Check whether the package expects a different transport or an app-oriented startup flow.\n- Use the recent stderr lines below before assuming this is a harness bug.\nRecent stderr:\n- 2026/07/15 15:35:43 Failed to initialize Chatwoot client: CHATWOOT_URL environment variable is required"
}
