{
  "artifactType": "run",
  "schemaVersion": "1.0.0",
  "gate": "fail",
  "runId": "run_2026-07-15T175709488Z_9e92c47f",
  "createdAt": "2026-07-15T17:57:09.488Z",
  "toolVersion": "1.32.1",
  "target": {
    "targetId": "redis-server",
    "adapter": "local-process",
    "command": "npx",
    "args": [
      "-y",
      "mcp-server-redis"
    ],
    "cwd": ".",
    "metadata": {
      "package": "mcp-server-redis",
      "purpose": "mcp-safety-index",
      "riskClass": "Cache and data store mutation",
      "failureClass": "Key/value mutation boundary",
      "whyItMatters": "Redis MCP servers can read, write, and delete keys, manage pub/sub channels, and execute Lua scripts — agents could manipulate cache and session data."
    }
  },
  "environment": {
    "platform": "darwin 25.5.0",
    "nodeVersion": "v22.22.1"
  },
  "summary": {
    "total": 3,
    "pass": 0,
    "fail": 0,
    "partial": 0,
    "unsupported": 0,
    "flaky": 0,
    "skipped": 3,
    "gate": "fail"
  },
  "checks": [
    {
      "id": "tools",
      "capability": "tools",
      "status": "skipped",
      "durationMs": 0,
      "message": "Skipped because startup failed before the MCP session initialized. See the failure diagnosis.",
      "evidence": []
    },
    {
      "id": "prompts",
      "capability": "prompts",
      "status": "skipped",
      "durationMs": 0,
      "message": "Skipped because startup failed before the MCP session initialized. See the failure diagnosis.",
      "evidence": []
    },
    {
      "id": "resources",
      "capability": "resources",
      "status": "skipped",
      "durationMs": 0,
      "message": "Skipped because startup failed before the MCP session initialized. See the failure diagnosis.",
      "evidence": []
    }
  ],
  "fatalError": "Could not establish a plain stdio MCP session for target `redis-server`.\nCommand: npx -y mcp-server-redis\nDiagnosis: The process exited or detached before MCP initialization completed.\nRaw error: MCP error -32000: Connection closed\nLikely causes:\n- The package may expect extra startup arguments or environment variables.\n- The package may not behave like a plain local-process stdio target under this invocation.\n- The server may be crashing immediately and only leaving clues on stderr.\nNext steps:\n- Run the command manually and look for usage output, auth prompts, or crash text.\n- Check whether the package expects a different transport or an app-oriented startup flow.\n- Use the recent stderr lines below before assuming this is a harness bug.\nRecent stderr:\n- /Users/williamweishuhn/.npm/_npx/19a26c80466dfc5c/node_modules/.bin/mcp-server-redis: line 10: AGENTS.md: command not found\n- /Users/williamweishuhn/.npm/_npx/19a26c80466dfc5c/node_modules/.bin/mcp-server-redis: line 11: AGENTS.md: command not found\n- /Users/williamweishuhn/.npm/_npx/19a26c80466dfc5c/node_modules/.bin/mcp-server-redis: line 12: action/: is a directory\n- /Users/williamweishuhn/.npm/_npx/19a26c80466dfc5c/node_modules/.bin/mcp-server-redis: line 14: syntax error near unexpected token `('\n- /Users/williamweishuhn/.npm/_npx/19a26c80466dfc5c/node_modules/.bin/mcp-server-redis: line 14: `const os = require('os');'"
}
