{
  "artifactType": "run",
  "schemaVersion": "1.0.0",
  "gate": "fail",
  "runId": "run_2026-07-22T213703140Z_812bbb80",
  "createdAt": "2026-07-22T21:37:03.140Z",
  "toolVersion": "1.34.1",
  "target": {
    "targetId": "slack-server",
    "adapter": "local-process",
    "command": "npx",
    "args": [
      "-y",
      "@modelcontextprotocol/server-slack"
    ],
    "cwd": ".",
    "metadata": {
      "package": "@modelcontextprotocol/server-slack",
      "purpose": "mcp-safety-index",
      "riskClass": "Messaging platform access",
      "failureClass": "Message/channel boundary",
      "whyItMatters": "Slack MCP servers can expose channel history, message posting, and workspace search capabilities to agents."
    }
  },
  "environment": {
    "platform": "darwin 25.5.0",
    "nodeVersion": "v22.23.1"
  },
  "summary": {
    "total": 3,
    "pass": 0,
    "fail": 0,
    "partial": 0,
    "unsupported": 0,
    "flaky": 0,
    "skipped": 3,
    "gate": "fail"
  },
  "checks": [
    {
      "id": "tools",
      "capability": "tools",
      "status": "skipped",
      "durationMs": 0,
      "message": "Skipped because startup failed before the MCP session initialized. See the failure diagnosis.",
      "evidence": []
    },
    {
      "id": "prompts",
      "capability": "prompts",
      "status": "skipped",
      "durationMs": 0,
      "message": "Skipped because startup failed before the MCP session initialized. See the failure diagnosis.",
      "evidence": []
    },
    {
      "id": "resources",
      "capability": "resources",
      "status": "skipped",
      "durationMs": 0,
      "message": "Skipped because startup failed before the MCP session initialized. See the failure diagnosis.",
      "evidence": []
    }
  ],
  "fatalError": "Could not establish a plain stdio MCP session for target `slack-server`.\nCommand: npx -y @modelcontextprotocol/server-slack\nDiagnosis: The process exited or detached before MCP initialization completed.\nRaw error: MCP error -32000: Connection closed\nLikely causes:\n- The package may expect extra startup arguments or environment variables.\n- The package may not behave like a plain local-process stdio target under this invocation.\n- The server may be crashing immediately and only leaving clues on stderr.\nNext steps:\n- Run the command manually and look for usage output, auth prompts, or crash text.\n- Check whether the package expects a different transport or an app-oriented startup flow.\n- Use the recent stderr lines below before assuming this is a harness bug.\nRecent stderr:\n- npm warn deprecated @modelcontextprotocol/server-slack@2025.4.25: Package no longer supported. Contact Support at https://www.npmjs.com/support for more info.\n- Please set SLACK_BOT_TOKEN and SLACK_TEAM_ID environment variables"
}
