{
  "artifactType": "run",
  "schemaVersion": "1.0.0",
  "gate": "fail",
  "runId": "run_2026-07-15T223454145Z_5d8dbd75",
  "createdAt": "2026-07-15T22:34:54.145Z",
  "toolVersion": "1.32.1",
  "target": {
    "targetId": "sendgrid-mcp",
    "adapter": "local-process",
    "command": "npx",
    "args": [
      "-y",
      "sendgrid-mcp"
    ],
    "cwd": ".",
    "metadata": {
      "package": "sendgrid-mcp",
      "purpose": "mcp-safety-index",
      "riskClass": "Email sending platform access",
      "failureClass": "Email send/template boundary",
      "whyItMatters": "SendGrid MCP servers can send transactional and marketing emails, manage templates, and view delivery stats — agents could email users at scale."
    }
  },
  "environment": {
    "platform": "darwin 25.5.0",
    "nodeVersion": "v22.22.1"
  },
  "summary": {
    "total": 3,
    "pass": 0,
    "fail": 0,
    "partial": 0,
    "unsupported": 0,
    "flaky": 0,
    "skipped": 3,
    "gate": "fail"
  },
  "checks": [
    {
      "id": "tools",
      "capability": "tools",
      "status": "skipped",
      "durationMs": 0,
      "message": "Skipped because startup failed before the MCP session initialized. See the failure diagnosis.",
      "evidence": []
    },
    {
      "id": "prompts",
      "capability": "prompts",
      "status": "skipped",
      "durationMs": 0,
      "message": "Skipped because startup failed before the MCP session initialized. See the failure diagnosis.",
      "evidence": []
    },
    {
      "id": "resources",
      "capability": "resources",
      "status": "skipped",
      "durationMs": 0,
      "message": "Skipped because startup failed before the MCP session initialized. See the failure diagnosis.",
      "evidence": []
    }
  ],
  "fatalError": "Could not establish a plain stdio MCP session for target `sendgrid-mcp`.\nCommand: npx -y sendgrid-mcp\nDiagnosis: The process exited or detached before MCP initialization completed.\nRaw error: MCP error -32000: Connection closed\nLikely causes:\n- The package may expect extra startup arguments or environment variables.\n- The package may not behave like a plain local-process stdio target under this invocation.\n- The server may be crashing immediately and only leaving clues on stderr.\nNext steps:\n- Run the command manually and look for usage output, auth prompts, or crash text.\n- Check whether the package expects a different transport or an app-oriented startup flow.\n- Use the recent stderr lines below before assuming this is a harness bug.\nRecent stderr:\n- at main (file:///Users/williamweishuhn/.npm/_npx/29b615f2cb2bb80b/node_modules/sendgrid-mcp/build/index.js:27:21)\n- at file:///Users/williamweishuhn/.npm/_npx/29b615f2cb2bb80b/node_modules/sendgrid-mcp/build/index.js:40:1\n- at ModuleJob.run (node:internal/modules/esm/module_job:343:25)\n- at async onImport.tracePromise.__proto__ (node:internal/modules/esm/loader:665:26)\n- at async asyncRunEntryPointWithESMLoader (node:internal/modules/run_main:117:5)"
}
